{
  "$schema": "http://json-schema.org/draft-07/schema#",
  "$id": "https://github.com/OpenCoven/familiar-contract/schemas/familiar-identity-bundle.schema.json",
  "title": "Familiar Historical Identity Bundle v1",
  "type": "object",
  "additionalProperties": false,
  "required": ["profile", "canonicalization", "familiarRootId", "identityRevisionId", "lineagePosition", "recordedAt", "components", "bundleDigest", "retention"],
  "properties": {
    "profile": { "const": "familiar.identity_bundle.v1" },
    "canonicalization": { "const": "jcs-rfc8785" },
    "familiarRootId": { "$ref": "#/definitions/opaqueId" },
    "identityRevisionId": { "$ref": "#/definitions/opaqueId" },
    "lineagePosition": { "type": "integer", "minimum": 0, "maximum": 9007199254740991 },
    "recordedAt": { "$ref": "#/definitions/timestamp" },
    "components": {
      "type": "array", "minItems": 2,
      "items": {
        "type": "object", "additionalProperties": false,
        "required": ["componentId", "mediaType", "digest", "redactionState"],
        "properties": {
          "componentId": { "enum": ["identity-declaration", "soul-declaration", "ward-declaration"] },
          "mediaType": { "const": "application/json" },
          "content": { "type": "object" }, "redactionState": { "enum": ["retained", "redacted"] }, "redactionEvidence": { "type": "string", "minLength": 1 },
          "digest": { "$ref": "#/definitions/digest" }
        },
        "allOf": [
          {
            "if": { "properties": { "redactionState": { "const": "retained" } } },
            "then": {
              "required": ["content"],
              "not": { "required": ["redactionEvidence"] }
            }
          },
          {
            "if": { "properties": { "redactionState": { "const": "redacted" } } },
            "then": {
              "required": ["redactionEvidence"],
              "not": { "required": ["content"] }
            }
          }
        ]
      }
    },
    "bundleDigest": { "$ref": "#/definitions/digest" },
    "retention": {
      "type": "object", "additionalProperties": false,
      "required": ["classification", "verifierAccess", "recordedAt", "tombstoneState", "replicaPurgeState", "redactionState"],
      "properties": {
        "classification": { "const": "restricted-historical-identity" },
        "verifierAccess": { "enum": ["authorized", "denied"] },
        "recordedAt": { "$ref": "#/definitions/timestamp" },
        "tombstoneState": { "enum": ["live", "tombstoned", "erased"] },
        "replicaPurgeState": { "enum": ["not_requested", "pending", "complete"] },
        "erasureEvidence": { "type": "string", "minLength": 1 },
        "deviceRevocationEvidence": { "type": "string", "minLength": 1 },
        "redactionState": { "enum": ["none", "redacted"] }
      },
      "allOf": [
        {
          "if": { "properties": { "redactionState": { "const": "none" } } },
          "then": {
            "properties": {
              "tombstoneState": { "const": "live" },
              "replicaPurgeState": { "const": "not_requested" }
            },
            "not": {
              "anyOf": [
                { "required": ["erasureEvidence"] },
                { "required": ["deviceRevocationEvidence"] }
              ]
            }
          }
        },
        {
          "if": { "properties": { "tombstoneState": { "const": "live" } } },
          "then": {
            "properties": { "replicaPurgeState": { "const": "not_requested" } },
            "not": { "required": ["erasureEvidence"] }
          }
        },
        {
          "if": { "properties": { "tombstoneState": { "const": "tombstoned" } } },
          "then": {
            "required": ["erasureEvidence"],
            "properties": {
              "redactionState": { "const": "redacted" },
              "replicaPurgeState": { "enum": ["pending", "complete"] }
            }
          }
        },
        {
          "if": { "properties": { "tombstoneState": { "const": "erased" } } },
          "then": {
            "required": ["erasureEvidence", "deviceRevocationEvidence"],
            "properties": {
              "redactionState": { "const": "redacted" },
              "replicaPurgeState": { "const": "complete" }
            }
          }
        }
      ]
    }
  },
  "definitions": {
    "opaqueId": { "type": "string", "pattern": "^[a-z][a-z0-9_-]*:[A-Za-z0-9._:-]+$" },
    "timestamp": { "type": "string", "pattern": "^\\d{4}-\\d{2}-\\d{2}T\\d{2}:\\d{2}:\\d{2}(?:\\.\\d+)?(?:Z|[+-]\\d{2}:\\d{2})$" },
    "hash": { "type": "string", "pattern": "^[0-9a-f]{64}$" },
    "digest": { "type": "object", "additionalProperties": false, "required": ["algorithm", "value"], "properties": { "algorithm": { "const": "sha-256" }, "value": { "$ref": "#/definitions/hash" } } }
  }
}
