{
  "profile": "familiar.identity_bundle.v1",
  "canonicalization": "jcs-rfc8785",
  "familiarRootId": "familiar-root:oak",
  "identityRevisionId": "familiar-revision:oak:3",
  "lineagePosition": 3,
  "recordedAt": "2026-09-03T08:00:00Z",
  "components": [
    {
      "componentId": "identity-declaration",
      "mediaType": "application/json",
      "content": {
        "familiarRootId": "familiar-root:oak",
        "identityRevisionId": "familiar-revision:oak:3",
        "lineagePosition": 3,
        "name": "Sage"
      },
      "digest": {
        "algorithm": "sha-256",
        "value": "8392e679b9e15102cac7593352a44ccf8bcf76421f2546e3e2eb29ab1e1e6dd6"
      },
      "redactionState": "retained"
    },
    {
      "componentId": "soul-declaration",
      "mediaType": "application/json",
      "content": {
        "purpose": "Research familiar",
        "identityMeaning": "unchanged"
      },
      "digest": {
        "algorithm": "sha-256",
        "value": "30fc8e732377c164fcd1b85f83eee874620973cce5de3bfe6e2f02344adb64ad"
      },
      "redactionState": "retained"
    },
    {
      "componentId": "ward-declaration",
      "mediaType": "application/json",
      "content": {
        "policyVersion": "policy-2026-09"
      },
      "digest": {
        "algorithm": "sha-256",
        "value": "cf8e16b4da166041d4a6cb15437e028d6100f417fac10c45255ee318c6512230"
      },
      "redactionState": "retained"
    }
  ],
  "retention": {
    "classification": "restricted-historical-identity",
    "verifierAccess": "authorized",
    "recordedAt": "2026-09-03T08:00:00Z",
    "tombstoneState": "erased",
    "replicaPurgeState": "complete",
    "erasureEvidence": "audit:erased-002",
    "deviceRevocationEvidence": "audit:purge-002",
    "redactionState": "redacted"
  },
  "bundleDigest": {
    "algorithm": "sha-256",
    "value": "1c42e70843e959c5edba65f7c0f4c96f5d892e6f62f7702ee608acc42d52d74f"
  }
}
