{
  "profile": "familiar.identity_bundle.v1",
  "canonicalization": "jcs-rfc8785",
  "familiarRootId": "familiar-root:willow",
  "identityRevisionId": "familiar-revision:willow:0",
  "lineagePosition": 0,
  "recordedAt": "2026-09-03T08:00:00Z",
  "components": [
    {
      "componentId": "identity-declaration",
      "mediaType": "application/json",
      "content": {
        "familiarRootId": "familiar-root:willow",
        "identityRevisionId": "familiar-revision:willow:0",
        "lineagePosition": 0,
        "name": "Willow"
      },
      "digest": {
        "algorithm": "sha-256",
        "value": "c6e599275442580cdd221c1ee6096c59f732d9352c8bb73ad90921321b8f066c"
      },
      "redactionState": "retained"
    },
    {
      "componentId": "soul-declaration",
      "mediaType": "application/json",
      "content": {
        "purpose": "Research familiar",
        "identityMeaning": "unchanged"
      },
      "digest": {
        "algorithm": "sha-256",
        "value": "30fc8e732377c164fcd1b85f83eee874620973cce5de3bfe6e2f02344adb64ad"
      },
      "redactionState": "retained"
    },
    {
      "componentId": "ward-declaration",
      "mediaType": "application/json",
      "content": {
        "policyVersion": "policy-2026-09"
      },
      "digest": {
        "algorithm": "sha-256",
        "value": "cf8e16b4da166041d4a6cb15437e028d6100f417fac10c45255ee318c6512230"
      },
      "redactionState": "retained"
    }
  ],
  "retention": {
    "classification": "restricted-historical-identity",
    "verifierAccess": "authorized",
    "recordedAt": "2026-09-03T08:00:00Z",
    "tombstoneState": "live",
    "replicaPurgeState": "not_requested",
    "redactionState": "none"
  },
  "bundleDigest": {
    "algorithm": "sha-256",
    "value": "6fa42dd0c2fa992a7683d1693872a89c8558816f2161f37eb21bf1c43884a4b4"
  }
}
