{
  "profile": "familiar.identity_bundle.v1",
  "canonicalization": "jcs-rfc8785",
  "familiarRootId": "familiar-root:maple",
  "identityRevisionId": "familiar-revision:maple:0",
  "lineagePosition": 0,
  "recordedAt": "2026-09-03T08:00:00Z",
  "components": [
    {
      "componentId": "identity-declaration",
      "mediaType": "application/json",
      "content": {
        "familiarRootId": "familiar-root:maple",
        "identityRevisionId": "familiar-revision:maple:0",
        "lineagePosition": 0,
        "name": "Sage"
      },
      "digest": {
        "algorithm": "sha-256",
        "value": "e97cb110eb3ded123930545fe90cb20ce705c61419aa11f5a23f7f447e4ed079"
      },
      "redactionState": "retained"
    },
    {
      "componentId": "soul-declaration",
      "mediaType": "application/json",
      "content": {
        "purpose": "Research familiar",
        "identityMeaning": "unchanged"
      },
      "digest": {
        "algorithm": "sha-256",
        "value": "30fc8e732377c164fcd1b85f83eee874620973cce5de3bfe6e2f02344adb64ad"
      },
      "redactionState": "retained"
    },
    {
      "componentId": "ward-declaration",
      "mediaType": "application/json",
      "content": {
        "policyVersion": "policy-2026-09"
      },
      "digest": {
        "algorithm": "sha-256",
        "value": "cf8e16b4da166041d4a6cb15437e028d6100f417fac10c45255ee318c6512230"
      },
      "redactionState": "retained"
    }
  ],
  "retention": {
    "classification": "restricted-historical-identity",
    "verifierAccess": "authorized",
    "recordedAt": "2026-09-03T08:00:00Z",
    "tombstoneState": "live",
    "replicaPurgeState": "not_requested",
    "redactionState": "none"
  },
  "bundleDigest": {
    "algorithm": "sha-256",
    "value": "06332d1e0d74cd50abfceca1594b2b3dcd03a0d27d25f3393c247d54a3f01534"
  }
}
